,label,text
284,Fungal infection,"Recently, I've been scratching myself a lot, and my skin is covered with rashy places. In addition, there are a few spots where my skin doesn't appear to be its usual shade, and I've experienced a few lumps that are quite painful."
285,Fungal infection,"I've been really itchy lately and there are these rashy spots all over my skin. There are also some areas that don't look like the normal color of my skin, and I've had some bumps that are kind of hard"
286,Fungal infection,"I've been quite itchy recently, and I have rashy places all over my body. There are also some regions that don't appear to be the typical hue of my skin, and I've experienced some firm lumps."
287,Fungal infection,"I've been itching and have rashy patches all over my skin recently. There are also some regions that don't appear to be the regular tone of my skin, and I've experienced some painful bumps."
288,Fungal infection,"Recently, I've been itching myself a lot, and my skin is covered with rashy patches. Furthermore, there are a few regions where my skin doesn't appear to be its usual tone, and I've experienced a few lumps that are exceptionally painful."
289,Common Cold,"I can't stop sneezing and my nose is really runny. I'm also really cold and tired all the time, and I've been coughing a lot. My fever is really high too, like way above normal."
290,Common Cold,"My nose is extremely runny, and I can't seem to stop sneezing. In addition, I constantly feel cold, exhausted, and I've been coughing a lot. My fever is also really high far above normal."
291,Common Cold,"I've been sneezing nonstop and I can't seem to shake this chill. I'm feeling really weak and tired, and my cough won't go away. My fever is really high"
292,Common Cold,"I've been sneezing incessantly and I just can't get this chill to go away. I feel so weak and exhausted, and my cough won't stop. My temperature is really high."
293,Common Cold,I'm constantly sneezing and my body is shaking from being cold. I'm so tired I can barely move and my head is killing me. My fever is through the roof
294,Common Cold,"I'm constantly sneezing, and the cold is making my body tremble. I'm so exhausted that I can hardly move, and my head hurts. My fever is quite high."
295,Common Cold,"I've been quite exhausted and ill. I'm sneezing nonstop and am quite cold. My head is throbbing, and I lack energy. Additionally, I have a very high fever and feel like I am on fire."
296,Common Cold,"I've been feeling really tired and sick. I've been sneezing a lot and I can't seem to get warm. I'm so tired and my head is killing me. And my fever is really high, like I'm boiling."
297,Common Cold,"I've been quite exhausted and ill. My throat has been quite painful, and I've had a fairly nasty cough. I've got a lot of chills and a pretty high temperature. Just feeling extremely run down and weak"
298,Common Cold,"I've been quite exhausted and ill. I have been sneezing a lot and am having trouble warming up. I'm so exhausted, and my head hurts. And I feel like I am boiling over with my high temperature."
299,Common Cold,I can't stop sneezing and I feel really tired and crummy. My throat is really sore and I have a lot of gunky stuff in my nose and throat. My neck feels swollen and puffy too.
300,Common Cold,"I can't stop sneezing, and I'm exhausted and sick. My throat is really uncomfortable, and there is a lot of junk in my nose and throat. My neck is also swollen and puffy."
301,Common Cold,"I keep sneezing, and I'm miserable and exhausted. I have a lot of gunky things in my nose and throat, and my throat is really hurting. My neck also feels puffy and swollen."
302,Common Cold,I've been feeling really exhausted and sick to my stomach. I've had a really bad cough and my throat has hurt a lot. I've experienced substantial sinus pressure and a congested nose. I'm really unpleasant and worn out.
303,Common Cold,I've been sneezing a lot and feeling really tired and sick. There's also a lot of gross stuff coming out of my nose and my throat feels really scratchy. And my neck feels swollen too.
304,Common Cold,"I've been wheezing a lot and am generally feeling sick and exhausted. My throat feels really scratchy, and a lot of gross stuff is flowing out of my nose. My neck also feels bloated."
305,Common Cold,"My sinuses feel incredibly congested, and my eyes are continuously red. I just constantly feel drained and exhausted. In addition, I have a lot of uncomfortable phlegm in my throat. My lymph nodes feel bloated, and breathing has been challenging."
306,Common Cold,My eyes have been really red and my sinuses feel congested. I just don't have any energy and my throat has been really itchy. I've also noticed my lymph nodes are swollen and I've been coughing up a lot of phlegm.
307,Common Cold,"My sinuses feel stuffy, and my eyes have been quite red. I simply lack energy, and my throat has been really scratchy. Along with the swelling in my lymph nodes, I've also been coughing up a lot of phlegm."
308,Common Cold,"My eyes are always red and itchy, and my nose feels all stuffy and congested. I just feel kind of sick and tired all the time, and I keep coughing up all this gunk. My throat feels sore and scratchy, and I've noticed that the bumps on my neck are bigger than usual"
309,Common Cold,"My nose always feels stuffy and congested, and my eyes are always red and itching. I have a feeling of being unwell and fatigued, and I keep hacking up this gunk. I have a scratchy, irritated throat, and I've seen that my neck's bumps are larger than usual."
310,Common Cold,"I keep sneezing, and my eyes don't quit dripping. It's incredibly difficult for me to breathe because it feels like there is something trapped in my throat. I often feel exhausted, and lately, I've had a lot of phlegm. Moreover, my lymph nodes are enlarged."
311,Common Cold,My eyes are red and watery all the time. I've also had this pressure in my sinuses that won't go away. I'm always feeling tired and I've been having a lot of trouble breathing. I've also had a lot of gunk in my throat and my lymph nodes are swollen.
312,Common Cold,"My eyes are constantly red and runny. A persistent tightness in my sinuses has also been bothering me. I've been having a lot of difficulties breathing and constantly feel fatigued. In addition, I have a lot of throat mucus and inflamed lymph nodes."
313,Common Cold,"My nose feels quite clogged, and my eyes are constantly very red and runny. In addition, my chest hurts and I've been having a lot of breathing problems. In addition, my muscles feel quite painful, and I can't smell anything."
314,Common Cold,"My eyes are usually red and runny, and my nose is always stuffy. I've also been having difficulty breathing and my chest hurts. In addition, I can't smell anything and my muscles are quite painful."
315,Common Cold,"My eyes are usually red and inflamed, and I have the impression that something is clogging my sinuses. I've been coughing up a lot of gunk, and my chest hurts. I can't smell anything, and my muscles are aching."
316,Common Cold,"My eyes are always red and swollen, and I feel like there's something blocking my sinuses. I've been coughing up a lot of goo and my chest feels really heavy. I can't smell anything and my muscles are really sore"
317,Common Cold,"I've been coughing a lot and feeling chilly and shivery. My nose has been quite clogged, and I am experiencing facial pressure. I also have a lot of phlegm, and coughing pains my chest. I can't smell anything, and my muscles are aching."
318,Common Cold,"For days, I've had a nasty cough and cold. My sinuses are clogged, and I have facial pressure. I've also been creating phlegm, and coughing pains my chest. I can't smell anything, and my muscles are aching."
319,Common Cold,"I've had a nasty cough and cold for days. My sinuses are congested, and I have facial pressure. I've also been coughing up mucus, and it pains my chest. I can't smell anything and my muscles are aching."
320,Common Cold,"My cough and cold have been awful for days. My sinuses are congested, and my face is under strain. Additionally, I've been coughing up phlegm, and it hurts in my chest. I have no sense of smell, and my muscles hurt a lot."
321,Common Cold,"I'm coughing nonstop and I'm shivering terribly. I have a stuffy nose and my face is under strain. In addition, my throat is coughing up some nasty gunk, and my chest hurts. My muscles hurt a lot, and I can't smell anything."
322,Common Cold,I can't stop coughing and I feel really cold. My sinuses are all blocked and I have a lot of mucus. My chest hurts and I can't smell anything. My muscles are also really sore.
323,Common Cold,"I'm coughing nonstop and am really chilly. My mucus production is excessive, and my sinuses are fully clogged. I can't smell anything, and my chest hurts. My muscles are quite painful as well."
324,Common Cold,"I can't stop coughing and I'm freezing. My sinuses are completely blocked, and I'm inundated with mucous. My chest hurts, and I'm unable to smell anything. My muscles are also really achy."
325,Common Cold,"I've been coughing a lot and finding it difficult to breathe. My throat hurts and I feel like I have a lot of phlegm trapped in my chest. My nose has been running a lot, and I've been feeling really congested."
326,Common Cold,"I've been quite exhausted and ill. My throat has been quite painful, and I've had a fairly nasty cough. I've got a lot of chills and a pretty high temperature. Just feeling extremely run down and weak"
327,Common Cold,"I've been experiencing severe weariness and a sickly sensation. My throat has been really painful and I've had a fairly severe cough. My nose has been quite stuffy, and I've had significant sinus pressure. I'm really miserable and extremely exhausted."
328,Common Cold,I've been feeling really sick and I've had a lot of fatigue. I've had a really bad cough and my throat has been really sore. I've had a lot of sinus pressure and my nose has been really congested. I just feel really run down and miserable.
329,Common Cold,"I've been quite exhausted and ill. My throat has been quite painful, and I've had a fairly nasty cough. I've got a lot of chills and a pretty high temperature. Simply put, I feel really run down and feeble."
330,Pneumonia,"I've been feeling really cold and tired lately, and I've been coughing a lot with chest pain. My heart is beating really fast too, and when I cough, the phlegm is kind of a rusty color."
331,Pneumonia,"I've been coughing a lot recently with chest pain and feeling incredibly chilly and exhausted. Additionally, my heart is thumping rapidly, and the phlegm I cough up has a reddish hue."
332,Pneumonia,"I've been feeling really drained and cold, and I can't stop coughing. It hurts in my chest when I do, and my heart feels like it's racing. The mucus I'm coughing up is a gross brownish color."
333,Pneumonia,"I've been exhausted and chilly, and I can't stop coughing. When I do, it pains in my chest and makes my heart race. My coughing mucous has a disgusting brownish hue."
334,Pneumonia,"I've been having chills and feeling exhausted, and I can't seem to shake this cough. My chest hurts when I cough, and my heart feels like it's going a million miles an hour. The phlegm I'm coughing up is a dirty rust color."
335,Pneumonia,"I've been experiencing chills, feeling worn out, and I can't seem to get rid of this cough. When I cough, my chest aches and my heart feels as like it is beating a million miles per hour. I'm coughing up a nasty rust-colored phlegm."
336,Pneumonia,"I've been feeling really weak and cold lately, and this cough won't go away. It hurts in my chest when I cough, and my heart is pounding. The mucus I'm bringing up is a rusty brown color."
337,Pneumonia,"I've been having chills and feeling really worn out, and this cough won't go away. My chest hurts when I cough, and my heart is racing. The mucus I'm bringing up is a gross brownish color."
338,Pneumonia,"I've been experiencing chills, feel really exhausted, and my cough just won't go away. When I cough, my chest aches and my heart is pounding. It's a disgusting brownish hue, the mucous I'm coming up."
339,Pneumonia,"I have a really high fever, and I'm having trouble breathing. I'm sweating a lot and feeling really cold and tired. My heart is beating really fast, and I have some brownish sputum"
340,Pneumonia,"I'm having problems breathing and have a very high fever. I'm perspiring a lot and experiencing extreme fatigue and chilly. My heart is racing, and I'm coughing up some brownish mucus."
341,Pneumonia,"My temperature is very high, and I'm having a hard time breathing. I'm sweating profusely, and I'm shaking with chills. I'm really tired, and my heart is beating really fast. I also have some brownish phlegm coming up"
342,Pneumonia,"I'm having trouble breathing, and my fever is really high. I'm drenched in sweat and shivering from the chill. My heart is thumping rapidly, and I'm quite exhausted. Additionally, I'm about to have some brownish phlegm."
343,Pneumonia,"My fever is really high, and I'm having trouble catching my breath. I'm sweating a lot, feeling cold and tired, and my heart is beating really fast. I also have some brownish phlegm coming up."
344,Pneumonia,"I have a really high fever, and I have problems breathing. My heart is racing quite quickly, I'm perspiring a lot, and I feel chilly and exhausted. I'm also about to cough out some brownish phlegm."
345,Pneumonia,"I've been feeling really sick with a high fever, shortness of breath, sweating, chills, and extreme fatigue. My heart rate is rapid, and I've been coughing up a lot of brownish sputum."
346,Pneumonia,"With a high temperature, shortness of breath, sweating, chills, and intense exhaustion, I've been feeling quite poorly. I've been coughing up a lot of brownish phlegm and my pulse rate is racing."
347,Pneumonia,I'm having a really hard time catching my breath and I'm sweating a lot. I feel really sick and have a lot of mucus in my throat. My chest hurts and my heart is racing. The mucus I'm coughing up is dark and looks like rust.
348,Pneumonia,"I'm sweating profusely and finding it difficult to catch my breath. I feel quite ill, and my throat is very mucous. My heart is pounding, and my chest aches. I'm coughing up thick mucous that resembles rust."
349,Pneumonia,"I'm having a lot of trouble breathing and am really uneasy. I'm feeling unwell and am perspiring a lot. My chest hurts and I have a lot of mucus in my throat. My heart is racing, and the hue of the mucus I'm coughing up is off."
350,Pneumonia,I can't seem to get enough air and I'm sweating a lot. I don't feel well and there's a lot of phlegm in my throat. My chest hurts and my heart is racing. The mucus I'm coughing up is reddish in color.
351,Pneumonia,"I'm sweating profusely and can't seem to get enough air. My throat is filled with a lot of mucus, and I don't feel good. My heart is pounding, and my chest aches. I'm coughing up reddish-colored mucous."
352,Pneumonia,I can't seem to catch my breath and I'm sweating a lot. I feel really sick and have a lot of phlegm in my throat. My chest hurts and my heart is racing. The mucus I'm coughing up is yellowish.
353,Pneumonia,"I'm dripping with perspiration and can't seem to catch my breath. My throat is filled with a lot of phlegm, and I feel awful. My heart is pounding, and my chest aches. I'm coughing up brownish mucous."
354,Pneumonia,I'm having a hard time breathing and I feel really uncomfortable. I'm sweating a lot and there's a lot of phlegm in my throat. My chest hurts and my heart is beating fast. The mucus I'm coughing up is brownish.
355,Pneumonia,"I'm having trouble breathing and am quite uneasy. My throat is filled with a lot of phlegm, and I'm perspiring a lot. My heart is racing, and my chest aches. I'm coughing up reddish mucous."
356,Pneumonia,I can't seem to catch my breath and I'm sweating a lot. I feel really sick and have a lot of phlegm in my throat. My chest hurts and my heart is racing. The mucus I'm coughing up is brownish and stringy.
357,Pneumonia,"I'm dripping with perspiration and can't seem to catch my breath. My throat is filled with a lot of phlegm, and I feel awful. My heart is pounding, and my chest aches. I'm coughing up a stringy, brownish mucous."
358,Pneumonia,"I'm drenched with sweat and struggling to breathe. I don't feel well and have a lot of mucous in my throat. My chest aches, and my heart is racing. I'm coughing up mucus that is crimson in colour."
359,Pneumonia,"I've been feeling very lousy, with a high temperature, shortness of breath, sweating, chills, and extreme weariness. My heart is beating, and I've been coughing up a lot of brownish phlegm."
360,Pneumonia,"I have a really high fever, and I have problems breathing. My heart is racing quite quickly, I'm perspiring a lot, and I feel chilly and exhausted. I'm also about to cough out some brownish phlegm."
361,Pneumonia,"My fever is really high, and I'm having difficulty breathing. I'm drenched in sweat and shivering with chills. I'm quite fatigued, and my heart is racing. I'm also expecting some brownish phlegm."
362,Pneumonia,"I've been getting chills, feeling tired, and I can't seem to shake this cough. My chest aches and my heart feels like it's racing at a million miles per hour when I cough. I'm coughing out a foul rusty phlegm."
363,Pneumonia,I'm having a hard time breathing and I feel really uncomfortable. I'm sweating a lot and there's a lot of phlegm in my throat. My chest hurts and my heart is beating fast. The mucus I'm coughing up is brownish.
364,Pneumonia,"I'm having trouble breathing and am really uncomfortable. I'm sweating profusely and have a lot of mucus in my throat. My chest aches, and my heart is racing. I'm coughing up dark mucous."
365,Pneumonia,"I've got a high fever and can't seem to catch my breath. I've been sweating profusely and generally feeling ill and weak. I've also had some quite thick and black phlegm. My chest aches, and my heart has been racing rapidly."
366,Pneumonia,"Lately I've been experiencing chills, fatigue, a cough, a high fever, and difficulty breathing. I've been sweating a lot and just feeling really sick and weak. I've also had some phlegm that's been really thick and dark."
367,Pneumonia,"I've recently been suffering with chills, lethargy, a cough, a high temperature, and difficulties breathing. I've been sweating profusely and generally feeling ill and weak. I've also had some quite thick and black phlegm."
368,Pneumonia,"Lately I've been experiencing chills, fatigue, a cough, a high fever, and difficulty breathing. I've been sweating a lot and just feeling really sick and weak. I've also had some phlegm that's been really thick and dark."
369,Pneumonia,"I've recently been suffering with chills, lethargy, a cough, a high temperature, and difficulties breathing. I've been sweating profusely and generally feeling ill and weak. I've also had some quite thick and red phlegm."
370,Pneumonia,"I've had chills, lethargy, a cough, a high temperature, and difficulties breathing lately. I've been sweating profusely and generally feeling ill and weak. I've also had some quite thick and black phlegm."
371,Dimorphic Hemorrhoids,"Constipation, discomfort with bowel motions, and anus pain have all recently been bothering me. My anus has been quite inflamed, and my stool has been extremely bloody."
372,Dimorphic Hemorrhoids,"Lately I've been experiencing constipation, pain during bowel movements, and pain in my anus. My stool has also been really bloody and my anus has been really irritated."
373,Dimorphic Hemorrhoids,"Recently, I've been having a lot of difficulty using the restroom. My bowel movements have been extremely uncomfortable and difficult for me to have.  My anus has been quite inflamed, and my stool has been extremely bloody."
374,Dimorphic Hemorrhoids,"I've been having a lot of trouble going to the bathroom lately. It's really painful when I do, and there's been some blood in my stool. I've also been having some pain and irritation around my anus."
375,Dimorphic Hemorrhoids,"Recently, I've been having a lot of difficulty using the restroom. When I do, it hurts a lot, and I've noticed some blood in my stool. Around my anus, I've also been experiencing some discomfort and itching."
376,Dimorphic Hemorrhoids,"Lately I've been really constipated, and it's been really painful when I do go to the bathroom. I've also noticed some blood in my stool, and my anus has been really irritated."
377,Dimorphic Hemorrhoids,"I've been suffering from severe constipation lately, and whenever I do go to the restroom, it hurts a lot. Aside from that, my anus has been really itchy, and I've observed some blood in my stool."
378,Dimorphic Hemorrhoids,"I've been having a lot of trouble going to the bathroom lately, and it's been really painful. I've also noticed that my stool has been bloody and my anus has been really irritated."
379,Dimorphic Hemorrhoids,"Recently, I've been having a lot of discomfort and difficulty using the restroom. Additionally, I've noticed that my anus has been quite sore and that my stool has been bloody."
380,Dimorphic Hemorrhoids,"I've been terribly constipated lately, and when I do go to the bathroom, it hurts a lot. Aside from that, my anus has been really itchy, and I've observed some blood in my stool."
381,Dimorphic Hemorrhoids,"I've been quite constipated lately, and going to the restroom has been excruciatingly uncomfortable. I've also observed blood in my stool, and my anus has been aggravated."
382,Dimorphic Hemorrhoids,I've been having a lot of trouble going to the bathroom lately. It's been really painful and I've been experiencing pain in my anus. My stool has also been bloody and my anus has been really irritated.
383,Dimorphic Hemorrhoids,"I've been having a lot of problems using the restroom recently. It's been excruciatingly uncomfortable, and I've been feeling agony in my anus. My stool has been bloody as well, and my anus has been really inflamed."
384,Dimorphic Hemorrhoids,"I've been having trouble going to the restroom recently. When I try to go, it's really uncomfortable, and my anus hurts a lot. I've also had some blood in my stool, and my anus has been really uncomfortable."
385,Dimorphic Hemorrhoids,I've been having a really hard time going to the bathroom lately. It's really painful when I try to go and my anus hurts a lot. There's also been some blood in my stool and my anus has been really itchy.
386,Dimorphic Hemorrhoids,"I've been experiencing problems using the restroom recently. It's quite difficult for me to go, and it hurts when I do. I've also been experiencing buttock soreness and bloody stools. My anus has also been quite itching and sensitive."
387,Dimorphic Hemorrhoids,"Recently, I've been having problems using the restroom. Going is incredibly difficult, and doing so hurts. In addition, I've been experiencing some butt soreness, and my stools have been bloody. My anus has also been quite itching and aggravated."
388,Dimorphic Hemorrhoids,"I've been constipated and it's really hard to go to the bathroom. When I do go, it hurts and my stool has been bloody. I've also been having some pain in my butt and my anus has been really itchy and irritated."
389,Dimorphic Hemorrhoids,"Since I've been constipated, using the restroom has been quite challenging. When I do go, it aches and I've had blood in my stool. My anus has been quite itchy and irritating, and I've also been experiencing some discomfort in my butt."
390,Dimorphic Hemorrhoids,"I've been constipated and it's really hard to go to the bathroom. When I do go, it hurts and my stool has been bloody. I've also been having some pain in my butt and my anus has been really itchy and irritated."
391,Dimorphic Hemorrhoids,"Since I've been constipated, using the restroom has been quite challenging. When I do go, it aches and I've had blood in my stool. My anus has been quite itchy and irritating, and I've also been experiencing some discomfort in my butt."
392,Dimorphic Hemorrhoids,"I've been constipated and it's really hard to go to the bathroom. When I do go, it hurts and my stool has been bloody. I've also been having some pain in my butt and my anus has been really itchy and irritated."
393,Dimorphic Hemorrhoids,"Constipation has made it quite difficult for me to use the restroom. My stool has been bloody when I do go, and it hurts. In addition, my anus has been quite itchy and inflamed, and I've been experiencing some butt soreness."
394,Dimorphic Hemorrhoids,"It's incredibly difficult for me to use the restroom, and when I do, it hurts a lot. My stools have been bloody, and my butt has been hurting. My anus has also been quite itching and aggravated."
395,Dimorphic Hemorrhoids,I'm having a lot of trouble going to the bathroom and it's really painful when I do. My stool has been bloody and I've had some pain in my butt. My anus has been really itchy and irritated too.
396,Dimorphic Hemorrhoids,I've been having trouble going to the bathroom. It's been really hard to go and it hurts when I do. My anus is really sore and it's been bleeding when I go. It's really painful and I'm really uncomfortable.
397,Dimorphic Hemorrhoids,"I've been finding it challenging to use the restroom. Going has been quite difficult, and it aches when I do. When I go, my anus bleeds and is really uncomfortable. I'm in a lot of discomfort and it hurts extremely bad."
398,Dimorphic Hemorrhoids,"I've been having difficulty using the restroom. It's been difficult to go, and it aches when I do. My anus is quite painful, and it has been bleeding whenever I go. It's excruciatingly painful, and I'm quite uneasy."
