,label,text
526,Bronchial Asthma," must confess that I've been experiencing shortness of breath, a persistent cough, and a high fever. I've also been producing a lot of thick, mucoid sputum, and I'm feeling quite drained and exhausted. It's all been rather tough to deal with, and I'm feeling quite sick at the moment"
527,Bronchial Asthma,"I must admit that I have been having a high fever, a persistent cough, and shortness of breath. In addition, I've been coughing up a lot of thick, mucoid saliva and I've been feeling really depleted and worn out."
528,Bronchial Asthma,"I've been having a tough time with this constant cough, difficulty breathing, and fatigue. My fever is high, and I've been coughing up a lot of thick, mucoid sputum. It's all been rather draining and exhausting, and I'm feeling quite sick at the moment."
529,Bronchial Asthma,"I've been struggling with a persistent cough, breathing issues, and exhaustion. I've been coughing up a lot of thick, mucoid sputum and have a high fever. All of this has been really tiring and exhausting, and right now I'm feeling rather ill."
530,Bronchial Asthma,"I've been dealing with a bad cough, breathing issues, and drowsiness. I've been coughing up a lot of thick, mucoid sputum and have a high fever. All of this has been really exhausting and exhausting, and right now I'm feeling rather ill."
531,Bronchial Asthma,"My persistent cough, breathing problems, and exhaustion have been making things difficult for me. I've been producing copious amounts of thick, mucoid sputum while also having a high fever. I'm currently feeling fairly ill because everything has been so tiring and exhausting."
532,Bronchial Asthma,"With my persistent cough, respiratory issues, and exhaustion, I've been struggling. I have a high fever and have been producing a lot of thick, mucoid sputum while coughing. I currently feel rather sick as a result of how draining and tiresome everything has been."
533,Bronchial Asthma,"My fever is through the roof, and I'm so weak and tired out. I've been coughing up a lot of mucous, and managing all of these symptoms has been really hard. Everything is making me so upset."
534,Bronchial Asthma,"Doctor Due to a high fever, I haven't been able to breathe via my nose or mouth for a few days and feelinf too tired. Please recommend some medications for me."
535,Bronchial Asthma,"Hey, I've got a dry cough, trouble breathing, and a high fever. I'm producing a lot of mucus and am feeling quite weak and exhausted."
536,Hypertension,"I have been experiencing a headache, chest pain, dizziness, and difficulty maintaining my balance. I also feel like I am having trouble concentrating"
537,Hypertension,"Along with a headache, chest pain, instability, and balance issues, I've also been feeling dizzy. I also think I'm having problems focusing."
538,Hypertension,"Along with a head pain, chest pain, instability, and balance issues, I've also been feeling unwell. I also think I'm having problems focusing."
539,Hypertension,"In addition to a head pain, chest pain, instability, and balance issues, I've already been feeling unwell. I also suppose I'm having issues focusing."
540,Hypertension,"I've been experiencing balance issues, a headache, chest pain, and dizziness. My ability to concentrate and focus has also been challenging."
541,Hypertension,"I have been having a headache, chest pain, dizziness, and trouble with my balance. It has also been hard for me to focus and concentrate."
542,Hypertension,"I've been encountering trouble walking, a headache, chest pain, and dizziness. My concentration skills and focus has also been challenging."
543,Hypertension,"I've been encountering poor balance, a headache, chest pain, and dizziness. My ability to pay attention and focus has also been problematic."
544,Hypertension,"My coordination has been off, and I've been experiencing a headache, chest pain, and dizziness. Additionally, I've had trouble concentrating and focusing."
545,Hypertension,"My symptoms include a headache, chest pain, dizziness, lack of balance, and trouble concentrating."
546,Hypertension,"I have been experiencing symptoms such as a headache, chest pain, dizziness, loss of balance, and difficulty focusing."
547,Hypertension,"I've been suffering from symptoms including a headache, chest pain, dizziness, losing my balance, and trouble concentrating."
548,Hypertension,"Headache, chest discomfort, dizziness, lack of balance, and difficulty concentrating are some of the symptoms I've been having."
549,Hypertension,"Along with a headache and chest pain, I also experienced fainting and balance issues. Additionally, I've discovered that it's hard for me to focus."
550,Hypertension,"I've been experiencing balance issues, a headache, chest pain, and dizziness. I've also realised that I'm having trouble focusing."
551,Hypertension,"My balance has been off, and I have a headache, chest pain, and dizziness. I've also observed that it's hard for me to concentrate."
552,Hypertension,"I've been experiencing balance issues, chest pain, headaches, and pains. I've been having trouble focusing as well."
553,Hypertension,"I have been experiencing chest pain, dizziness, and a headache that feels like a continual pressure in my forehead."
554,Hypertension,"I have been feeling lightheaded and unsteady on my feet, and have also noticed a decline in my ability to focus and concentrate."
555,Hypertension,"I've been experiencing dizziness and shakiness, as well as a loss in my attention span and ability to concentrate."
556,Hypertension,"I've been experiencing dizziness and anxiousness, as well as a loss in my attention and concentration and ability to concentrate."
557,Hypertension,"I've had intense aches in my chest, a headache that won't go away, and I've been feeling dizzy and unsteady."
558,Hypertension,"I've had intense aches in my chest, a head  pain that refuses to go away, and I've been feeling dizzy and unsteady."
559,Hypertension,"Along with chest pain, dizziness, and a headache that feels like a narrow zone around my head, I have been having a lot of trouble."
560,Hypertension,"I have been struggling with a headache that feels like a tight band around my head, along with chest pain and dizziness."
561,Hypertension,I've been experiencing balance issues in addition to feeling disoriented and dizzy. My headache has also been present nonstop.
562,Hypertension,"I have been feeling disoriented and dizzy, and have also had trouble keeping my balance. My headache has been a constant presence as well."
563,Hypertension,"I've been experiencing balance issues along with feeling dizzy and lightheaded. Additionally, I've seen a drop in my concentration and focus."
564,Hypertension,"In addition to feeling dizzy and lightheaded, I've been having problems keeping my equilibrium. My capacity to concentrate and focus has also been slipping, I've noticed."
565,Hypertension,"I have been experiencing a headache that feels like a sharp pain in my temples, along with chest pain and dizziness."
566,Hypertension,"Along with a chest pain and dizziness, I've had a headache that seems like a sharp pain in my forehead."
567,Hypertension,"I have been feeling fine all day, but suddenly developed a headache, chest pain, and dizziness while out for a walk. It's been hard for me to focus and concentrate since then."
568,Hypertension,"While taking a walk, I suddenly started experiencing headache, chest pain, and dizziness after feeling fine all day. Since then, it has been challenging for me to concentrate and focus."
569,Hypertension,"I woke up this morning with a headache and chest pain, and as the day has gone on, I've also been feeling dizzy and unsteady on my feet"
570,Hypertension,"I had a headache and chest pain this morning, and as the day wore on, I also started to feel unsteady and unstable on my feet."
571,Hypertension,"I have been dealing with a headache and chest pain for a few days now, but today the dizziness and loss of balance became much worse."
572,Hypertension,"For a few days now, I've been suffering from a headache and chest pain, but today the dizziness and lack of balance got considerably worse."
573,Hypertension,"I was at work when I started feeling a headache, chest pain, and dizziness. It's been hard for me to concentrate and focus on my tasks since then."
574,Hypertension,"When I first experienced a headache, chest pain, and lightheadedness, I was at work. Since then, it has been challenging for me to focus and concentrate on my work."
575,Hypertension,"I was in the middle of a workout when I suddenly developed a headache, chest pain, and dizziness. It's been hard for me to maintain my balance since then"
576,Hypertension,"I instantly experienced a headache, chest pain, and dizziness while working out. Since then, it has been challenging for me to keep my balance."
577,Hypertension,"I have been feeling fine all day, but suddenly developed a headache, chest pain, and dizziness while driving home from work. It's been hard for me to focus and concentrate on the road since then."
578,Migraine,"I have been experiencing acidity and indigestion after meals, as well as frequent headaches and blurred vision."
579,Migraine,"I've been getting frequent headaches and hazy vision, as well as acid reflux and indigestion after meals."
580,Migraine,"I have been having trouble with my vision, seeing things as distorted and experiencing visual disturbances."
581,Migraine,"I've been suffering visual disruptions, seeing things as distorted, and eyesight problems."
582,Migraine,"I've been facing visual disruptions, seeing things as distorted, and eyesight difficulties."
583,Migraine,"I have been feeling excessively hungry, even after eating, and have had a stiff neck."
584,Migraine,"I've been facing visual disruptions, seeing things as distorted, and eyesight difficulties."
585,Migraine,"I've been grumpy and gloomy lately, and I've also noticed a change in my vision."
586,Migraine,"I have been feeling depressed and irritable, and have noticed a change in my vision."
587,Migraine,"I've been irritated and depressed lately, and I've also noticed a change in my vision."
588,Migraine,"Along with recurrent headaches and blurred vision, I suffer acid reflux and trouble digesting my food."
589,Migraine,"I have been experiencing acid reflux and difficulty digesting my food, along with regular headaches and impaired vision"
590,Migraine,"I have been feeling hungry all the time and have had a sore neck, as well as problems with my vision."
591,Migraine,"In addition to having a stiff neck and eye issues, I have been always hungry."
592,Migraine,"I have been experiencing acidity, indigestion, headaches, and blurred and distorted vision, as well as excessive hunger, a stiff neck, depression, irritability, and visual disturbance."
593,Migraine,"Along with excessive appetite, a stiff neck, depression, impatience, and visual disturbance, I've also been having indigestion, headaches, blurred vision, and acid reflux."
594,Migraine,"Along with excessive appetite, a stiff neck, depression, impatience, and visual disturbance, I've also been suffering indigestion, headaches, blurred vision, and stomach problems."
595,Migraine,"I have been suffering from acid reflux, indigestion, frequent headaches, and impaired vision, as well as excessive hunger, a sore neck, depression, irritability, and visual disturbance."
596,Migraine,"Along with increased hunger, a sore neck, melancholy, impatience, and visual distortion, I've also been experiencing acid reflux, indigestion, frequent headaches, and blurred eyesight."
597,Migraine,"Together with increased hunger, a sore neck, anxiety, irritation, and visual distortion, I've also been experiencing acid reflux, indigestion, frequent headaches, and impaired eyesight."
598,Migraine,"I have been experiencing digestive issues, including acidity and indigestion, as well as regular headaches and distorted vision, excessive hunger, a stiff neck, depression, irritability, and visual disturbance."
599,Migraine,"In addition to recurrent headaches and blurred vision, increased appetite, a stiff neck, sadness, irritability, and visual disturbance, I have been having stomach problems, including indigestion and acidity."
600,Migraine,"In add to frequent headaches and blurred vision, increased appetite, a stiff neck, anxiety, irritability, and visual disturbance, I have been having stomach problems, including indigestion and acidity."
601,Migraine,"I have been struggling with acid reflux, indigestion, and headaches, as well as blurred and distorted vision, excessive hunger, a sore neck, depression, irritability, and visual disturbance."
602,Migraine,"Along with headaches, indigestion, acid reflux, excessive appetite, a sore neck, sadness, impatience, and visual disturbance, I have also been experiencing blurred and distorted vision."
603,Migraine,"Along with headaches, indigestion, acid reflux, excessive appetite, a sore neck, sadness, impatience, and visual disturbance, I have also been feeling blurred and distorted vision."
604,Migraine,"I have been experiencing digestive issues, including acidity and indigestion, as well as frequent headaches and impaired vision, excessive hunger, a stiff neck, depression, irritability, and visual disturbance"
605,Migraine,"Acidity and indigestion are among the digestive problems I've been having, along with regular headaches, blurred vision, increased hunger, stiff neck, sadness, impatience, and visual disruption."
606,Migraine,"I have been suffering from acid reflux, indigestion, and regular headaches, as well as distorted vision, excessive hunger, a sore neck, depression, irritability, and visual disturbance."
607,Migraine,"Along with distorted eyesight, excessive appetite, a painful neck, melancholy, irritability, and regular headaches, I have also been experiencing acid reflux, indigestion, and regular headaches."
608,Migraine,"Along with distorted eyesight, excessive appetite, a painful neck, anxiety, irritability, and regular headaches, I have also been battling acid reflux, indigestion, and regular headaches."
609,Migraine,"I have been experiencing acidity, indigestion, and frequent headaches, as well as blurred and distorted vision, excessive hunger, a stiff neck, depression, irritability, and visual disturbance."
610,Migraine,"Stomach acid, indigestion, frequent headaches, hazy and distorted vision, increased appetite, stiff neck, depression, irritation, and visual distortion have all been bothering me."
611,Migraine,"I have been struggling with digestive issues, including acid reflux and indigestion, as well as regular headaches and impaired vision, excessive hunger, a sore neck, depression, irritability, and visual disturbance"
612,Migraine,"I have been experiencing frequent headaches, blurred vision, excessive appetite, a sore neck, sadness, irritability, and digestive problems including indigestion and acid reflux."
613,Migraine,"I have been enduring frequent headaches, blurred vision, excessive appetite, a sore neck, anxiety, irritability, and digestive difficulties including indigestion and acid reflux."
614,Migraine,"I have been experiencing acidity, indigestion, and headaches, as well as blurred and distorted vision, excessive hunger, a stiff neck, depression, irritability, and visual disturbance"
615,Migraine,"Along with excessive appetite, a stiff neck, headaches, indigestion, and acid reflux, I've also been experiencing sadness, impatience, and visual distortion."
616,Migraine,"Along with excessive appetite, a stiff neck, headaches, indigestion, and acid reflux, I've also been experiencing sadness, impatience, and visual distortion."
617,Migraine,"I have been suffering from acid reflux, indigestion, and frequent headaches, as well as distorted vision, excessive hunger, a sore neck, depression, irritability, and visual disturbance."
618,Migraine,"Along with impaired eyesight, increased appetite, a sore neck, melancholy, impatience, and regular headaches, I've also been experiencing heartburn, acid reflux, and indigestion."
619,Cervical spondylosis,"I have been experiencing severe back pain, a persistent cough, and weakness in my limbs. My neck also hurts and I have been feeling dizzy and off balance."
620,Cervical spondylosis,"Along with a chronic cough and limb weakness, I've been dealing with excruciating back discomfort. I've been experiencing neck pain as well as vertigo and instability."
621,Cervical spondylosis,"I have been suffering from back pain, a hacking cough, and weakness in my arms and legs. Additionally, my neck hurts and I have had issues with dizziness and maintaining my balance."
622,Cervical spondylosis,"Back pain, a hacking cough, and numbness in my arms and legs have been bothering me. In addition, my neck hurts, and I've having trouble staying balanced and without getting lightheaded."
623,Cervical spondylosis,"Back pain, a coughing cough, and numbness in my arms and legs have been plaguing me. In addition, my neck hurts, and I've having trouble staying balanced and without getting woozy."
624,Cervical spondylosis,"Pain typically, a coughing cough, and numbness in my arms and legs have been plaguing me. In addition, my neck hurts, and I've having trouble staying balanced and without getting woozy."
625,Cervical spondylosis,"I have been struggling with back pain, a cough that won't go away, and weakness in my extremities. My neck hurts and I have had problems with dizziness and losing my balance."
626,Cervical spondylosis,"Back discomfort, a persistent cough, and weakness in my limbs have been bothering me. I have issues with vertigo and losing my equilibrium, and my neck hurts."
627,Cervical spondylosis,"Back discomfort, a breathing difficulty, and weakness in my limbs have been hurting me. I have issues with vertigo and losing my balance, and my neck hurts."
628,Cervical spondylosis,"I have been experiencing intense back pain, a dry cough, and a lack of strength in my limbs. My neck hurts and I have been feeling dizzy and unsteady on my feet."
629,Cervical spondylosis,"I've been struggling with severe back pain, a dry cough, and limb weakness. I've been feeling lightheaded and wobbly on my feet, and my neck hurts."
630,Cervical spondylosis,"I've been battling with back pain, a dry cough, and limb weakness. I've been feeling dizzy and unstable on my feet, and my neck hurts."
631,Cervical spondylosis,"I've been struggling with back pain, a chronic cough, and limb weakness. I've been feeling disoriented and weak on my feet, and my neck hurts."
632,Cervical spondylosis,"I have been suffering from back pain, a productive cough, and weakness in my limbs. My neck is sore and I have had issues with dizziness and balance."
633,Cervical spondylosis,"Back pain, a productive cough, and limb weakness have been bothering me. I have balance and dizzy concerns, and my neck hurts."
634,Cervical spondylosis,"Backache, a difficulty breathing, and limb weakness have been bothering me. I have balance and dizzy concerns, and my neck suffers."
635,Cervical spondylosis,"I have been struggling with back pain, a persistent cough, and weakness in my muscles. My neck hurts and I have had problems with dizziness and loss of balance."
636,Cervical spondylosis,"Back pain, a lingering cough, and muscle weakness have been bothering me. I have issues with dizziness and losing my equilibrium, and my neck hurts."
637,Cervical spondylosis,"Back pain, a chronic cough, and muscle weakness have been bothering me. I have concerns with dizziness and losing my position, and my neck hurts."
638,Cervical spondylosis,"I have been experiencing severe back pain, a cough that comes and goes, and weakness in my limbs. My neck also hurts and I have been feeling dizzy and off balance."
639,Cervical spondylosis,"I've been having intermittent coughing fits, significant back pain, and limb weakness. I've been experiencing neck pain as well as a dizzy and unsteady sensation."
640,Cervical spondylosis,"I've been having periodic coughing fits, terrible back pain, and limb weakness. I've been feeling neck pain as well as a dizzy and unstable sensation."
641,Cervical spondylosis,"I have been dealing with back pain, a cough that won't go away, and weakness in my arms and legs. My neck hurts and I have had problems with dizziness and maintaining my balance."
642,Cervical spondylosis,"Back pain, a persistent cough, and numbness in my arms and legs have been bothering me. I've had trouble staying balanced and experiencing dizziness, and my neck hurts."
643,Cervical spondylosis,"Back pain, a dry cough, and stiffness in my arms and legs have been bothering me. I've had problems staying balanced and experience dizziness, and my neck hurts."
644,Cervical spondylosis,"I've been experiencing back pain, a persistent cough, and numbness in my arms and legs. I've been having trouble staying balanced and managing my vertigo, and my neck hurts."
645,Cervical spondylosis,"My arms and legs have been weak, and I have been suffering from back pain and a persistent cough. In addition to experiencing neck pain and balance issues, I also suffer dizziness."
646,Cervical spondylosis,"Back pain, a persistent cough, and arm and leg weakness have been bothering me. I've been experiencing neck pain, balance issues, and dizziness."
647,Cervical spondylosis,"Back pain, a persistent cough, and numbness in my arms and legs have been bothering me. I've had trouble staying balanced and experiencing dizziness, and my neck hurts."
648,Cervical spondylosis,"I have been suffering from back pain, a dry cough, and a lack of strength in my muscles. My neck is sore and I have been feeling dizzy and unsteady on my feet"
649,Cervical spondylosis,"Back pain, a dry cough, and a lack of muscle strength have been bothering me. My neck hurts, and I've been feeling lightheaded and shaky."
650,Cervical spondylosis,"My muscles lack strength, and I have been experiencing back pain and a dry cough. I've been experiencing neck pain and feeling lightheaded and unstable on my feet."
651,Cervical spondylosis,"My muscles haven't been very strong, and I've been experiencing back ache. I've been feeling lightheaded and wobbly on my feet, and my neck hurts."
652,Cervical spondylosis,"I've been experiencing back pain, a dry cough, and muscle weakness. I've been experiencing neck pain, feeling lightheaded, and having trouble standing still."
653,Cervical spondylosis,"I have been struggling with intense back pain, a chronic cough, and weakness in my arms and legs. My neck is sore and I have had problems with dizziness and loss of balance."
654,Cervical spondylosis,"I've had terrible back pain, a persistent cough, and weakness in my arms and legs. I have issues with dizziness and balance loss, and my neck hurts."
655,Cervical spondylosis,"I've been suffering from severe back pain, a persistent cough, and numbness in my arms and legs. I've been experiencing issues with vertigo and balance issues, and my neck hurts."
656,Cervical spondylosis,"Along with a persistent cough, weakness in my arms and legs, and severe back pain, I've been having a lot of trouble. I've experienced issues with vertigo and balance loss, and my neck is hurting."
657,Cervical spondylosis,"I have been experiencing severe back pain, a cough that produces phlegm, and weakness in my muscles. My neck also hurts and I have been feeling dizzy and unsteady on my feet."
658,Cervical spondylosis,"In addition to having excruciating back pain, I've also been coughing up mucus and feeling weak all over. I've been feeling lightheaded and unstable on my feet, and my neck hurts as well."
659,Cervical spondylosis,"My muscles have been quite weak, and I've been coughing up phlegm along with significant back discomfort. In addition to feeling weak and disoriented, my neck has been hurting."
660,Jaundice,"I have been experiencing intense itching, vomiting, and fatigue. I have also lost weight and have a high fever. My skin has turned yellow and my urine is dark. I have also been experiencing abdominal pain."
661,Jaundice,"I've been feeling extremely scratchy, sick, and worn out. In addition, I've lost weight and have a temperature. My urine is dark, and my skin has turned yellow. Additionally, I've been having stomach pain."
662,Jaundice,"I've felt really scratchy, nauseated, and worn out. I also had a high fever and lost weight. Both my skin and my urine have become yellow. Additionally, my stomach has been hurting."
663,Jaundice,"Extreme itchiness, sickness, and exhaustion have all been plaguing me. In addition, I developed a fever and lost weight. My pee is black, and I've developed a yellow rash. Additionally, I've had stomach ache."
664,Jaundice,I have been having severe itching and vomiting. I am also very tired and have lost weight. My fever is high and my skin has turned yellow. My urine is dark and I have been experiencing abdominal pain
665,Jaundice,"I've been experiencing intense itching and nausea. I have lost weight and am also really exhausted. My skin has become yellow, and I have a severe fever. I have dark urine, and I've been having stomach pain."
666,Jaundice,"I've been throwing up and experiencing intense itching. Along with losing weight, I'm also really exhausted. My skin has become yellow, and my fever is really high. I've been having stomach pain and my pee is black."
667,Jaundice,"Strong itchiness and nausea have been bothering me. I have also lost weight and am really exhausted. I have a high fever, and my skin is becoming yellow. In addition to feeling stomach ache, my pee is black."
668,Jaundice,I've been experiencing terrible itching and nausea. I've lost weight and am also really exhausted. My skin has become yellow and I have a severe temperature. I have dark urine and stomach ache.
