,label,text
0,Psoriasis,"I have been experiencing a skin rash on my arms, legs, and torso for the past few weeks. It is red, itchy, and covered in dry, scaly patches."
1,Psoriasis,"My skin has been peeling, especially on my knees, elbows, and scalp. This peeling is often accompanied by a burning or stinging sensation."
2,Psoriasis,"I have been experiencing joint pain in my fingers, wrists, and knees. The pain is often achy and throbbing, and it gets worse when I move my joints."
3,Psoriasis,"There is a silver like dusting on my skin, especially on my lower back and scalp. This dusting is made up of small scales that flake off easily when I scratch them."
4,Psoriasis,"My nails have small dents or pits in them, and they often feel inflammatory and tender to the touch. Even there are minor rashes on my arms."
5,Psoriasis,The skin on my palms and soles is thickened and has deep cracks. These cracks are painful and bleed easily.
6,Psoriasis,"The skin around my mouth, nose, and eyes is red and inflamed. It is often itchy and uncomfortable. There is a noticeable inflammation in my nails."
7,Psoriasis,My skin is very sensitive and reacts easily to changes in temperature or humidity. I often have to be careful about what products I use on my skin.
8,Psoriasis,"I have noticed a sudden peeling of skin at different parts of my body, mainly arms, legs and back. Also, I face severe joint pain and skin rashes."
9,Psoriasis,"The skin on my genitals is red and inflamed. It is often itchy, burning, and uncomfortable. There are rashes on different parts of the body too."
10,Psoriasis,"I have experienced fatigue and a general feeling of malaise. I often feel tired and have a lack of energy, even after a good night's sleep."
11,Psoriasis,"The rash on my skin has spread to other parts of my body, including my chest and abdomen. It is itchy and uncomfortable, and it is often worse at night. I am also facing skin peeling."
12,Psoriasis,The rash on my skin is worse in the winter months when the air is dry. I find that I have to moisturize more frequently and use humidifiers to keep my skin hydrated.
13,Psoriasis,"I have experienced difficulty sleeping due to the itching and discomfort caused by the rash. There are small dents in my nails, which is really concerning."
14,Psoriasis,"My skin is prone to infections due to dry, flaky patches. I am experiencing a strong pain in my joints. The skin on my knees and elbows is starting to peel off."
15,Psoriasis,"I am starting to have rashes on my skin. The rash often bleeds when I scratch or rub it. Moreover, I have noticed small dents in my nails."
16,Psoriasis,"I have noticed that my skin has become more sensitive than it used to be. There is a silver like dusting on my skin, especially on my back and elbows."
17,Psoriasis,"I am worried about the constant peeling of the skin on my palm, elbow and knee. I have developed rashes on my arms, which itch if I touch them. All of these are making my life quite discomforting and miserable."
18,Psoriasis,"There is strange pain in my joints. Also, I have noticed strange peeling of skin in different parts of my body. I am afraid there is something wrong going on with my body."
19,Psoriasis,"My nails have small dents on them. Even my joints have started to pain severely. There is a silver like dusting on my skin, particularly in my back."
20,Psoriasis,"The rashes on my skin are not healing. Moreover, I have noticed a sudden peeling of the skin, especially the skin on my elbows and knees. I am really worried about this."
21,Psoriasis,"For the past few weeks, I've had a skin rash on my arms, legs, and chest. It's red and irritating, with dry, scaly spots. I have a strange pain in my joints too."
22,Psoriasis,"My skin is peeling, particularly on my knees, elbows, and scalp. This peeling is frequently accompanied by a stinging or burning feeling."
23,Psoriasis,"I'm having joint discomfort in my fingers, wrists, and knees. The pain is frequently aching and throbbing, and it worsens when I move my joints."
24,Psoriasis,"My skin has a silvery film, particularly on my back, arms and scalp. This dusting is composed of tiny scales that easily peel off when scratched."
25,Psoriasis,"I have red and inflammatory skin around my mouth, nose, and eyes. It is frequently irritating and unpleasant. Recently, it has got very painful."
26,Psoriasis,My skin is extremely sensitive and quickly irritated by changes in temperature or humidity. My nails have developed dents on them. I am worried about this sudden change.
27,Psoriasis,"I've seen a sudden peeling of skin on various regions of my body, mostly my arms, legs, and back. In addition, I have significant joint pain and skin rashes. The rash is spreading to different parts of my body."
28,Psoriasis,"My genital skin is red and irritated. It is frequently irritating, burning, and unpleasant. There are also rashes in various places of the body. Also, I have a strange pain in my joints."
29,Psoriasis,"I've had trouble sleeping because of the itching and pain produced by the rash. My nails have little dents, which is really alarming. There is a noticeable inflammation in my nails."
30,Psoriasis,"Because of dry, flaky areas on my skin, I am prone to infections. My joints are in excruciating agony. The skin on my knees and elbows is beginning to flake."
31,Psoriasis,"My skin is breaking out in rashes. When I scratch or rub the rash, it frequently bleeds. In addition, I've observed little dents in my nails. There is a noticeable inflammation in my nails."
32,Psoriasis,"I've observed that my skin is more sensitive now than it used to be. My skin has a silvery film, especially on my back and elbows."
33,Psoriasis,"My palms and soles have grown and developed severe fissures. These cracks are unpleasant and frequently bleed. Also, the skin is starting to peel off."
34,Psoriasis,"My nails are starting to have small pits on them. I am worried and don't know what is causing it. Also, my joints pain and there are rashes on my arms and back."
35,Psoriasis,"There is a silver like dusting on my skin. Moreover, the skin on my arms and back are starting to peel off. This is strange and really concerning me."
36,Psoriasis,"My skin rash has extended to other areas of my body, including my chest and belly. It is irritating and unpleasant, and it is frequently worst at night. I'm also experiencing skin flaking."
37,Psoriasis,"My skin rash gets worse in the winter when the air is dry. To keep my skin moisturized, I have to moisturize more regularly and use humidifiers. I am also facing joint pain."
38,Psoriasis,I've had trouble sleeping because of the itching and pain produced by the rash. My nails have little dents. I am also experiencing skin peeling in different parts of my body.
39,Psoriasis,"My skin is peeling in places, especially on my knees, elbows, and arms. This peeling is often accompanied by a painful or burning sensation. I am also developing small dents on my nails, which is really concerning."
40,Psoriasis,"My skin has a silvery layer over it, especially on my back and arms. This dusting is made up of small scales that peel off readily when rubbed. Also, there are rashes all over my body."
41,Varicose Veins,"I have a rash on my legs that is causing a lot of discomforts. It seems there is a cramp and I can see prominent veins on the calf. Also, I have been feeling very tired and fatigued in the past couple of days."
42,Varicose Veins,"My calves have been cramping up when I walk or stand for long periods of time. There are bruise marks on my calves, which is making me worried. I feel tired very soon."
43,Varicose Veins,"There is bruising on my legs that I cannot explain. I can see strange blood vessels below the skin. Also, I am slightly obese and I am really worried."
44,Varicose Veins,I am overweight and have noticed that my legs are swollen and the blood vessels are visible. My legs have swollen and I can see a stream of swollen veins on my calves.
45,Varicose Veins,"The veins on my calves have become very prominent and causing discomfort. I can't stand for long periods of time, as it causes pain in my legs, similar to cramps."
46,Varicose Veins,The skin around the veins on my legs is red and inflamed. I believe I can see some of the swollen blood vessels. I am really worried about it.
47,Varicose Veins,Standing or walking for long periods of time causes a lot of pain in my legs. I get cramps upon doing physical activities. There are bruise marks on my legs too.
48,Varicose Veins,The cramps in my calves are making it difficult for me to walk. I feel fatigued after working for some time. I believe obesity is the reason behind this.
49,Varicose Veins,"The swelling in my legs has gotten worse over the past few weeks. Now, a large number of veins are noticeable on my calves, which is making me worried."
50,Varicose Veins,The veins on my legs are very noticeable and cause me discomfort. It seems like there is a major bruise and I get cramps when I run.
51,Varicose Veins,The skin on my calves has become inflamed and red. My legs hurt if I try to run or do any physical activities.
52,Varicose Veins,"Recently, the pain in my calves has been constant and becomes worse when I stand or walk for long periods of time. My legs have started to swell and also some blood vessels are quite noticeable."
53,Varicose Veins,The veins in my legs are causing discomfort and difficulty sleeping at night. I have no idea why it is happening. I get cramps when I sprint.
54,Varicose Veins,The swelling in my legs is causing me to have difficulty fitting into my shoes. I can't sprint or stand for long periods of time. I can see some swollen blood vessels.
55,Varicose Veins,I have noticed cramps in my calves are becoming more frequent and intense. It is causing me a lot of discomforts. I am also overweight and my legs have started to swell.
56,Varicose Veins,The veins on my legs cause a lot of discomforts when I sit for long periods of time.
57,Varicose Veins,The rash on my legs is spreading and becoming more severe. It has become very difficult for me to run.
58,Varicose Veins,My legs are causing a lot of discomforts when I exercise. I get frequent cramps and the blood vessels have become quite noticeable.
59,Varicose Veins,The prominent blood vessels on my calves are causing self-consciousness and embarrassment. I believe the problem is because of my overweight.
60,Varicose Veins,The skin around the veins on my legs is dry and flaky. It seems there is a major bruise and my legs have started to swell.
61,Varicose Veins,I have been experiencing a rash on my legs that is causing a lot of irritation and discomfort. It is red and inflamed and appears to be spreading.
62,Varicose Veins,"Recently, my calves have been cramping up frequently, especially when I am walking or standing for long periods of time. Also, the veins are very noticeable."
63,Varicose Veins,I have noticed that there are bruises on my legs that I cannot explain. They are not painful but are concerning to me.
64,Varicose Veins,"As I am overweight, I have noticed that my legs are swollen and the blood vessels are more visible than usual. The swelling seems to be getting worse over time."
65,Varicose Veins,The veins on my calves are very prominent and are causing me a lot of discomforts. They are swollen and protrude from my skin.
66,Varicose Veins,"The skin around the veins on my legs is red, inflamed, and itchy. It is causing a lot of discomforts and I am starting to get regular cramps."
67,Varicose Veins,Standing or walking for long periods of time has been causing a lot of pain in my legs. It feels like a cramp and becomes worse the longer I am on my feet.
68,Varicose Veins,The cramps in my calves have been making it difficult for me to walk and do my daily activities. They come on suddenly and last for several minutes.
69,Varicose Veins,The swelling in my legs has gotten worse over the past few weeks and is causing me difficulty fitting into my shoes. It is also causing discomfort when I sit for long periods of time.
70,Varicose Veins,"The veins on my legs are very noticeable and are causing me a lot of discomforts. They are swollen and protrude from my skin, making them visible through my clothing."
71,Varicose Veins,"The skin on my calves is itchy and inflamed, causing a lot of discomfort and difficulty sleeping at night. The blood vessels have started to protrude out, which is concerning."
72,Varicose Veins,The pain in my calves is constant and becomes worse when I stand or walk for long periods of time. I am getting constant cramps and can't run for longer periods of time.
73,Varicose Veins,"The veins in my legs are causing discomfort and difficulty sleeping at night. They are swollen and protruding from my skin, making them noticeable and painful."
74,Varicose Veins,The swelling in my legs is causing me to have difficulty fitting into my shoes and is causing discomfort when I sit for long periods of time.
75,Varicose Veins,"The cramps in my calves are becoming more frequent and intense, making it difficult for me to walk and do my daily activities."
76,Varicose Veins,"The veins on my legs are causing a lot of discomforts when I sit for long periods of time. They are swollen and protruding from my skin, making them painful and noticeable."
77,Varicose Veins,"The rash on my legs is spreading and becoming more severe. It is red, inflamed, and itchy, causing a lot of discomfort and difficulty sleeping at night."
78,Varicose Veins,"My legs have been causing a lot of discomforts when I exercise. They feel heavy and swollen, and the veins are prominent and painful. I feel fatigued all the time."
79,Varicose Veins,"The prominent veins on my calves are causing self-consciousness and embarrassment. They are swollen and protrude from my skin, making them very noticeable."
80,Varicose Veins,"The skin around the veins on my legs is dry and flaky, causing discomfort and irritation. I am also starting to get frequent cramps."
81,Varicose Veins,"I have a rash on my legs that is giving me a lot of pain. There appears to be a cramp, and I can see visible veins on the calf."
82,Typhoid,"I have constipation and belly pain, and it's been really uncomfortable. The belly pain has been getting worse and is starting to affect my daily life. Moreover, I get chills every night, followed by a mild fever."
83,Typhoid,"I've also had some diarrhea, which has been really unpleasant. It's been coming and going, and it's been accompanied by abdominal cramps and bloating."
84,Typhoid,"I have been experiencing chills and fever, along with severe abdominal pain. I've been feeling really miserable overall, and I just can't seem to shake these symptoms."
85,Typhoid,I've been having a lot of trouble keeping hydrated because of the vomiting and diarrhea. There is a mild fever along with constipation and headache.
86,Typhoid,"I've lost a lot of weight in the past week because I haven't been able to eat much due to nausea and vomiting. This is followed by mild fever, headache and belly pain. I'm really concerned about my health."
87,Typhoid,"The fatigue has been really uncomfortable, and I've had a lot of difficulties doing my usual activities. I've also been feeling really depressed and irritable. There is mild pain in the abdominal part too."
88,Typhoid,"I've had a persistent headache for the past week, and it's been getting worse. It's been accompanied by belly aches, constipation and diarrhea."
89,Typhoid,"I've been experiencing high fever, especially at night. It's been really uncomfortable. There is a mild headache along with constipation and diarrhea."
90,Typhoid,"I've been having a lot of difficulty breathing, and I feel like I'm constantly nauseous. I also have mild belly pain. It's been terrifying at times."
91,Typhoid,"Diarrhea has been really watery and foul-smelling, and it's been accompanied by abdominal pain. I feel like vomiting most of the time."
92,Typhoid,"I've been having a lot of trouble sleeping because of the high fever, headache and chills. I wake up every day having a terrible pain in my belly area."
93,Typhoid,"I've also been experiencing some diarrhea and constipation, which has been really worrying. It feels like a sharp, stabbing pain in my belly area. I feel tired all the time."
94,Typhoid,"I have had some constipation and belly pain, which has been really uncomfortable. The pain has been getting worse and it's really affecting my daily life."
95,Typhoid,"I am experiencing a lot of belly pain and constipation, which has been really annoying. Sometimes, I feel a strong urge to vomit, and because of all of these, I am feeling very weak."
96,Typhoid,"The abdominal pain has been coming and going, and it's been really unpleasant. It's been accompanied by constipation and vomiting. I feel really concerned about my health."
97,Typhoid,"I have been experiencing a lot of bloating and constipation, and it's been really uncomfortable. It feels like there's a lot of pressure and pain in my belly area."
98,Typhoid,"I am experiencing extreme belly pain and constipation. Every night, I have a severe fever along with chills and headaches. The last couple of days has been really uncomfortable."
99,Typhoid,"I've been feeling exhausted and weak, and I can't seem to get rid of it. Because of the vomiting and nausea, I've entirely lost my appetite. My belly pains which are causing me concern."
100,Typhoid,"I am experiencing constipation and stomach ache, which has been really difficult. The discomfort has gotten worse, and it is seriously interfering with my everyday life."
101,Typhoid,"Because of the vomiting and diarrhea, I've been having a lot of difficulties staying hydrated. I have a high fever, as well as constipation and headache."
102,Typhoid,The abdominal pain has been frequent and really painful. Constipation and vomiting have also occurred. I'm quite worried about my health.
103,Typhoid,"I'm having severe stomach pain and constipation. Every night, I get a headache and chills. The last few days have been really painful."
104,Typhoid,There is a distinct pain in my abdominal part. I am not sure what it is. I am also going through constant vomiting and feel nauseous.
105,Typhoid,"The diarrhea has been quite fluid and smelly, and it has been accompanied by severe abdominal pain and headache. Most of the time, I feel like vomiting."
106,Typhoid,"I have had a fever for the last couple of days. Now, I am starting to experience a severe pain in my stomach area and suffering from constipation."
107,Typhoid,"I am experiencing a lot of nausea and vomiting, and it's been quite difficult for me to eat anything. I've entirely lost my appetite, and as a result, I have become quite weak."
108,Typhoid,"I am having a lot of trouble sleeping because of the high fever and the headache. Moreover, I have constant belly pain, because of which I can't go to work."
109,Typhoid,"I have been feeling really fatigued and weak, and I can't seem to get rid of it. I have a mild fever and a strange pain in my abdominal area. I can't understand what is happening."
110,Typhoid,"I've been suffering from constipation and stomach discomfort, which has been really uncomfortable. Last night, I had a mild fever too."
111,Typhoid,"I've also been suffering from diarrhea, which has been really uncomfortable. It comes and goes, and it's accompanied by stomach aches and vomiting."
112,Typhoid,"I've been experiencing chills, fever, and extreme stomach discomfort. I've been generally unhappy, and I can't seem to get rid of these symptoms."
113,Typhoid,"Because of the vomiting and diarrhea, I've been having a lot of difficulties staying hydrated. There is a mild fever, too, as well as stomach pain."
114,Typhoid,"I have developed diarrhea. It is accompanied by severe pain in my belly area. I don't feel like eating anything, and most of the time, I have a mild headache."
115,Typhoid,"I've had a lot of bloating and constipation, which has been really painful. There is a lot of pressure and pain in my stomach area. I get a high fever and chills every night."
116,Typhoid,"I've had a persistent stomach pain for the past week, and it is not healing even with medication. I feel like vomiting and can't eat anything, and because of which I have become extremely weak."
117,Typhoid,I am having severe stomach discomfort and diarrhoea. I have a high fever along with a headache. The previous several days have been really unpleasant.
118,Typhoid,"I am having a terrible pain in my abdominal part, and I've been feeling really nauseated. I'm also experiencing a mild fever. I am really worried."
119,Typhoid,"I am experiencing constipation and stomach ache. The discomfort has gotten worse, and it is seriously interfering with my everyday life. I feel like I have lost my appetite to eat anything."
120,Typhoid,"Most of the time I feel fatigued. I don't want to eat anything. I get a high fever and chills every night. Moreover, I have been vomiting since yesterday."
121,Typhoid,"I have lost my appetite and have noticed a significant weight loss. I have abdominal pain, especially in the area of my stomach and intestines. I am concerned about my health."
122,Typhoid,The stomach discomfort has been severe and frequent. Vomiting and constipation have also happened. I'm concerned about my health.
123,Chicken pox,"I've been experiencing intense itching all over my skin, and it's driving me crazy. I also have a rash that's red and inflamed."
124,Chicken pox,"I'm feeling fatigued and have no energy. I can barely keep my eyes open during the day, and I've been feeling lethargic and unable to motivate myself."
125,Chicken pox,"I've had a high fever for the past few days. I don't know what's causing it. Also, I noticed rashes on my skin and it's hard for me to resist scratching."
126,Chicken pox,I've lost my appetite and can't seem to eat anything. I'm worried about my health.
127,Chicken pox,There are small red spots all over my body that I can't explain. It's worrying me. I feel extremely tired and experience a mild fever every night.
128,Chicken pox,"My lymph nodes are swollen, causing discomfort in my neck and armpits. I don't know what's causing it."
129,Chicken pox,"I'm feeling really sick and uncomfortable like something is wrong inside. I don't know what it could be. I noticed small red spots on my arms, which itches if I touch them."
130,Chicken pox,The itching is making it hard for me to sleep at night. I can't get any rest. I have also lost my appetite and feel lethargic.
131,Chicken pox,"I'm worried about this rash on my skin. It's spreading rapidly and causing a lot of discomforts. I can hardly sleep at night because of the itching,"
132,Chicken pox,I have no energy and have lost my appetite. I'm feeling really sick and don't know what's wrong.
133,Chicken pox,"I have a skin rash that's red and inflamed, and it's spreading all over my body. I've been experiencing intense itching, especially on my arms and legs."
134,Chicken pox,"I've had a high fever for the past few days, and it's starting to worry me. I don't know what's causing it. Also, I have red spots all over my arms and legs, some of which are swollen."
135,Chicken pox,"I have a skin rash that's red and swollen, and it's spreading all over my body. I have a mild fever and it is causing me a lot of discomforts."
136,Chicken pox,"I'm feeling fatigued and have no energy. I can barely keep my eyes open during the day, and I've been feeling lethargic and unable to motivate myself."
137,Chicken pox,There are small red spots all over my body that I can't explain. The bumps are itchy and uncomfortable and seem to spread rapidly. It's worrying me.
138,Chicken pox,The itching is making it hard for me to sleep at night. I can't seem to get any rest because the rash is so itchy and uncomfortable. I'm feeling really tired and exhausted.
139,Chicken pox,I have no energy and have lost my appetite. I have a high fever and severe headache and don't know what's wrong.
140,Chicken pox,The high fever and swollen lymph nodes are causing me much discomfort. I have a headache and feel weak and fatigued. It's hard for me to concentrate because of the fever.
141,Chicken pox,"The rash on my skin is causing a lot of discomforts. It's red and inflamed, spreading all over my body. The rash is accompanied by intense itching, especially on my arms and legs."
142,Chicken pox,"There are red spots all over my body that I can't explain. The spots are itchy and starting to swell, and they are spreading rapidly."
143,Chicken pox,I have small lymph nodes on my arms and face. The itching is making my day very uncomfortable.
144,Chicken pox,"I have no energy and have lost my appetite. I'm feeling really sick and don't know what's wrong. Also, there are small red spots starting to show on my skin."
145,Chicken pox,"I've had a mild fever for the past few days, and it's starting to worry me. The fever has been accompanied by a severe headache. I feel weak and lethargic."
146,Chicken pox,"I have swollen lymph nodes and red spots all over my body, and they are causing discomfort. I also have a mild fever and feel tired most of the time."
147,Chicken pox,"I've been suffering from severe itching all over my body, and it's driving me insane. I also have a red and irritating rash."
148,Chicken pox,"I have seen rashes on my skin, and it's difficult for me not to scratch. Also, I've had a high fever for several days. I'm not sure what's causing it."
149,Chicken pox,"I have little red spots all over my body that I don't understand. It worries me. I have lost my appetite and every night, I am exhausted and have a severe headache."
150,Chicken pox,"I'm feeling really sick and lost my appetite. I've seen little red patches on my arms, neck and face that itch when I touch them."
