,label,text
669,Jaundice,I have been feeling itchy and have been vomiting. I am also very fatigued and have lost weight. My fever is high and my skin has become yellow. My urine is dark and I have abdominal pain
670,Jaundice,"I've been feeling scratchy and throwing up. I have lost weight and am also really exhausted. My skin has become yellow, and I have a severe fever. I have stomach ache and black urine."
671,Jaundice,"I've been itchy and have been throwing up. Along with losing weight, I'm also really exhausted. My skin has turned yellow, and my fever is high. Additionally, I get stomach ache and dark urine."
672,Jaundice,"I've had a scratchy stomach and been throwing up. Aside from losing weight, I am also really exhausted. I have a high fever and yellow skin. Besides having stomach ache, my pee is black."
673,Jaundice,"I've been itchy and throwing up. In addition, I have lost weight and feel really exhausted. My skin has become yellow and I have a severe temperature. I have abdominal ache and black urine."
674,Jaundice,"I've been exhausted and experiencing nausea and itching. In addition, I've lost weight and have a temperature. My urine is dark, and my skin has turned yellow. Additionally, I've been having stomach pain."
675,Jaundice,"I have been suffering from itching, vomiting, and fatigue. I have also lost weight and have a high fever. My skin has turned yellow and my urine is dark. I have also been experiencing abdominal pain"
676,Jaundice,"I've been feeling scratchy, sick, and worn out. I also had a high fever and lost weight. Both my skin and my urine have become yellow. Additional stomach pain that I've been having"
677,Jaundice,"The itch, the nausea, and the weariness have been bothering me. In addition, I developed a fever and lost weight. My pee is black, and I've developed a yellow rash. Additionally, I've had stomach ache."
678,Jaundice,"I've had nausea, vomiting, and exhaustion. Additionally, I've lost weight and have a temperature. My urine is black and my skin has turned yellow. I've also been having stomach pain."
679,Jaundice,"I have been experiencing intense itching, vomiting, and fatigue. I have also lost weight and have a high fever. My skin has turned yellow and my urine is dark. I have been having abdominal pain as well."
680,Jaundice,"I've been feeling extremely scratchy, sick, and worn out. In addition, I've lost weight and have a temperature. My urine is dark, and my skin has turned yellow. Additionally, I have been experiencing stomach pain."
681,Jaundice,"I've been feeling extremely scratchy, sick, and worn out. In addition, I've lost weight and have a temperature. My urine is dark, and my skin has turned yellow. Additionally, I have been experiencing stomach pain."
682,Jaundice,"I've been feeling extremely scratchy, sick, and worn out. In addition, I've lost weight and have a temperature. My urine is dark, and my skin has turned yellow. Additionally, I have been experiencing stomach pain."
683,Jaundice,"I've been constantly feeling scratchy, sick, and tired out. In addition, I've lost weight and have a temperature. My urine is dark, and my skin has turned yellow. Furthermore, I have been experiencing stomach pain."
684,Jaundice,"I've felt really scratchy, nauseated, and worn out. I also had a high fever and lost weight. Both my skin and my urine have become yellow. I've also been experiencing stomach pain."
685,Jaundice,"I have been having severe itching, vomiting, and fatigue. I have also lost weight and have a high fever. My skin has turned yellow and my urine is dark. I am also experiencing abdominal pain."
686,Jaundice,"I've been feeling really scratchy, dizzy, and worn out. In addition, I've lost weight and have a temperature. My urine is dark, and my skin has turned yellow. Additionally, I get stomach pain."
687,Jaundice,"I've been experiencing intense itchiness, nausea, and exhaustion. I also had a high fever and lost weight. Both my skin and my urine have become yellow. Additionally, my stomach hurts."
688,Jaundice,"Extreme itchiness, nausea, and exhaustion have been bothering me. In addition, I developed a fever and lost weight. My pee is black, and I've developed a yellow rash. The ache in my stomach is also present."
689,Jaundice,"Extreme itchiness, nausea, and fatigue have been troubling me. In moreover, I experienced a fever and lost weight. My pee is black, and I've developed a yellow rash. The ache in my stomach is also present."
690,Jaundice,I have been feeling itchy and have been vomiting. I am also very tired and have lost weight. My fever is high and my skin has become yellow. I have been experiencing abdominal pain as well.
691,Jaundice,"I've been itchy and have been throwing up. Along with losing weight, I'm also really exhausted. My skin has turned yellow, and my fever is high. My stomach has also been hurting recently."
692,Jaundice,"I've had a scratchy stomach and been throwing up. I have also lost weight and am really exhausted. I have a high fever and yellow skin. As well as you, I have been having stomach pain."
693,Jaundice,I've been itchy and throwing up. I've lost weight and am also really exhausted. My skin has become yellow and I have a severe temperature. My stomach has also been hurting.
694,Jaundice,"I've been exhausted and experiencing nausea and itching. In addition, I've lost weight and have a temperature. My urine is dark, and my skin has turned yellow. Additionally, I've been having stomach pain."
695,Jaundice,"I have been suffering from itching, vomiting, and fatigue. I have also lost weight and have a high fever. My skin has turned yellow and my urine is dark. I have also been experiencing abdominal pain"
696,Jaundice,"I've been feeling scratchy, sick, and worn out. I also had a high fever and lost weight. Both my skin and my urine have become yellow. Additional stomach pain that I've been having"
697,Jaundice,"The itch, the nausea, and the weariness have been bothering me. In addition, I developed a fever and lost weight. My pee is black, and I've developed a yellow rash. Additionally, I've had stomach ache."
698,Jaundice,"I have been experiencing intense itching, vomiting, and fatigue. I have also lost weight and have a high fever. My skin has turned yellow and my urine is dark. I have been having abdominal pain as well."
699,Jaundice,"I've been feeling extremely scratchy, sick, and worn out. In addition, I've lost weight and have a temperature. My urine is dark, and my skin has turned yellow. Additionally, I have been experiencing stomach pain."
700,Jaundice,"I've felt really scratchy, nauseated, and worn out. I also had a high fever and lost weight. Both my skin and my urine have become yellow. I've also been experiencing stomach pain."
701,Malaria,"I've been experiencing severe itching, chills, vomiting, and a high fever. I'm also sweating a lot and have a headache. I feel nauseous and my muscles are really sore"
702,Malaria,"I've had a high temperature, vomiting, chills, and intense itching. I also have a headache and am perspiring a lot. I'm queasy, and my muscles hurt a lot."
703,Malaria,"I've had a high temperature, vomiting, chills, and intense itching. I also have a headache and am perspiring a lot. I'm queasy, and my muscles hurt a lot."
704,Malaria,"Strong itchiness, chills, nausea, and a high temperature have been plaguing me. Besides having a headache, I'm also perspiring a lot. My muscles are quite sore, and I feel sick."
705,Malaria,"Along with my intense scratching, chills, nausea, and high fever, I've also been feeling really unwell. Along with my headache and excessive sweating, My muscles hurt a lot, and I feel queasy."
706,Malaria,"I've had a high fever, chills, and intense itching. In addition, I have a headache and am perspiring a lot. My muscles hurt a lot, and I feel sick."
707,Malaria,"I've had intense itching all over my body, accompanied by chills and vomiting. My fever is really high and I've been sweating excessively. I also have a headache and feel nauseous. My muscles are really painful."
708,Malaria,"I've been experiencing severe body itchiness, chills, and vomiting. I have a really high fever, and I've been perspiring a lot. I also feel queasy and have a headache. My muscles are in excruciating discomfort."
709,Malaria,"Along with severe body itchiness, chills, and nausea, I've been experiencing. I've been severely perspiring and have a very high fever. I'm feeling queasy and also have a headache. Really hurting muscles are me."
710,Malaria,"I've been experiencing severe body itchiness, chills, and vomiting. I have a really high fever, and I've been perspiring a lot. I also feel queasy and have a headache. My muscles are in excruciating discomfort."
711,Malaria,"I've been experiencing severe body itchiness, along with chills and nausea. I've been perspiring a lot and have an extremely high fever. I feel sick to my stomach and have a headache. My muscles are hurting a lot."
712,Malaria,"I'm suffering from intense itching, chills, vomiting, and a high fever. I've also been sweating a lot and have a headache. Nausea and muscle pain have also been bothering me."
713,Malaria,"I have a high fever, severe itching, chills, and vomiting. I also have a headache and have been perspiring a lot. Additionally hurting me have been nausea and muscle soreness."
714,Malaria,"I have a high temperature, vomiting, chills, and severe itching. In addition, I've been perspiring a lot and have a headache. I've also been bothered by nausea and muscle ache."
715,Malaria,"Strong itchiness, chills, nausea, and a high fever are all part of my current condition. Besides having a headache, I've been perspiring a lot. I've been bothered by nausea as well as muscle ache."
716,Malaria,"I have a high fever, chills, and severe itching. In addition, I have a headache and have been perspiring a lot. I've also been bothered by nausea and muscular ache."
717,Malaria,"I have a high fever, severe itching, chills, and vomiting. I also have a headache and have been perspiring a lot. Additionally hurting me have been nausea and muscle soreness."
718,Malaria,"I have a high temperature, vomiting, chills, and severe itching. In addition, I've been perspiring a lot and have a headache. I've also been bothered by nausea and muscle ache."
719,Malaria,"I've been experiencing severe itching, chills, vomiting, and a high fever. I'm also sweating excessively and have a headache. Nausea and muscle pain have also been causing me discomfort."
720,Malaria,"I've had a high temperature, vomiting, chills, and intense itching. I also have a headache and am perspiring a lot. My discomfort has also been brought on by nausea and muscle ache."
721,Malaria,"Strong itchiness, chills, nausea, and a high temperature have been plaguing me. Along with having a headache, I'm also perspiring a lot. I've also been bothered by nausea and muscle ache."
722,Malaria,"Along with my intense scratching, chills, nausea, and high fever, I've also been feeling really unwell. I have a headache and am also perspiring a lot. I've been uncomfortable from nausea and muscle ache, too."
723,Malaria,"I've had a high fever, chills, and intense itching. In addition, I have a headache and am perspiring a lot. I've been suffering from nausea as well as muscle ache."
724,Malaria,"I've had a high temperature, vomiting, chills, and intense itching. I also have a headache and am perspiring a lot. My discomfort has also been brought on by nausea and muscle ache."
725,Malaria,"I've had intense itching, chills, vomiting, and a high fever. I'm also sweating a lot and have a headache. Nausea and muscle pain have been making me feel miserable."
726,Malaria,"I've been experiencing a lot of scratching, chills, vomiting, and a fever. I also have a headache and am perspiring a lot. I've been terrible with nausea and soreness in my muscles."
727,Malaria,"I've experienced severe itching, chills, nausea, and a high fever. Besides having a headache, I'm also perspiring a lot. I've been terrible with nausea and muscle ache."
728,Malaria,"I have a high fever, chills, and severe itching. Along with my headache and excessive sweating, I've been terrible with nausea and muscle ache."
729,Malaria,"I have a high fever, chills, and severe itching. In addition, I have a headache and am perspiring a lot. I've been feeling awful with nausea and muscle ache."
730,Malaria,"I've been experiencing severe itching, chills, vomiting, and a high fever. I'm also sweating a lot and have a headache. Nausea and muscle pain have been causing me a lot of discomfort."
731,Malaria,"I've had a high temperature, vomiting, chills, and intense itching. I also have a headache and am perspiring a lot. I've been really uncomfortable lately from nausea and muscle ache."
732,Malaria,"Strong itchiness, chills, nausea, and a high temperature have been plaguing me. Besides having a headache, I'm also perspiring a lot. I've been suffering from severe muscle pain and nausea."
733,Malaria,"Along with my intense scratching, chills, nausea, and high fever, I've also been feeling really unwell. Along with my headache and excessive sweating, I've been suffering from severe muscle pain and nausea."
734,Malaria,"I've had a high fever, chills, and intense itching. In addition, I have a headache and am perspiring a lot. I've been in a lot of agony from muscle ache and nausea."
735,Malaria,"I've had intense itching, chills, vomiting, and a high fever. I'm also sweating excessively and have a headache. Nausea and muscle pain have also been bothering me."
736,Malaria,"I've been experiencing a lot of scratching, chills, vomiting, and a fever. I also have a headache and am perspiring a lot. Additionally hurting me have been nausea and muscle soreness."
737,Malaria,"I've experienced severe itching, chills, nausea, and a high fever. Along with having a headache, I'm also perspiring a lot. I've also been bothered by nausea and muscle ache."
738,Malaria,"I have a high fever, chills, and severe itching. I have a headache and am also perspiring a lot. I've been bothered by nausea as well as muscle ache."
739,Malaria,"I've been experiencing severe itching, chills, vomiting, and a high fever. In addition, I have a headache and am perspiring a lot. I've also been bothered by nausea and muscular ache."
740,Malaria,"I'm suffering from severe itching, chills, vomiting, and a high fever. I've also been sweating a lot and have a headache. Nausea and muscle pain have also been causing me discomfort."
741,Malaria,"I have a high fever, severe itching, chills, and vomiting. I also have a headache and have been perspiring a lot. My discomfort has also been brought on by nausea and muscle ache."
742,Malaria,"I have a high fever, severe itching, chills, and vomiting. In addition, I've been perspiring a lot and have a headache. I've also been bothered by nausea and muscle ache."
743,urinary tract infection,"Frequent urges to urinate with little output, pain during urination, cloudy or bloody urine, strong or foul-smelling urine, pelvic pain, low fever, nausea and vomiting"
744,urinary tract infection,"I get frequent urges to urinate at night with little output, and a lot of pain during urination. The urine is coludy and bloody and sometime foul smelling, and I get nauseous"
745,urinary tract infection,I get a burning sensation when I pee. Sometimes a lot of pain and foul smelling urine. I have been getting more urges to urinate at night
746,urinary tract infection,I have been getting blood in my pee. Sometimes I get nauseous while peeing. This often almost coincides with me having a high temperature
747,urinary tract infection,"My pee looks cloudy and has storng and foul smell. I frequently get an urge to urinate at night, and have been getting high temperatures since these symptoms strted showing"
748,urinary tract infection,"I have pain in my abdomen, and often get feverish. I have sudden and strong urges to pee. The pain is almost constant, and often increases at night time. My pee almost always has a foul smell"
749,urinary tract infection,"I have been frequently getting sudden strong urges to pee. There is blood in my pee sometimes and it is very foul smelling. I think I have an infection, what do I do?"
750,urinary tract infection,"I get blood in my pee sometimes and sometimes get nauseous whie peeing. I also have a bad smell in my pee and sometimes get high temperatures at nights, help me"
751,urinary tract infection,"I have pain in my lower abdomen, and get a buring sensation in my pee. I also have been getting low temperatures since I started to get these other symptoms. I have been weak because of this"
752,urinary tract infection,There is blood in my urine and I have a low fever. My head hurts almost all the time and I get very strong uncontrollable urges to pee. I have been having pain in lower back also 
753,urinary tract infection,I have been having low temperatures and bloody pee since some days now. My head hurts like crazy and pee also smells very foul. I have almost no control on my peeing and get very sudden urges
754,urinary tract infection,I have pain near my pelvic region and vomit a lot. Sometimes there is blood in my pee and there is almost a very foul smell in my urine.I sometimes get headches and have trouble sleeping due to this
755,urinary tract infection,"I have to constantly to go the bathroom to relieve myself, but cant seem to empty my bladder. I get these very strong and uncontrollable urges to pee and sometimes get dark or bloody pee"
756,urinary tract infection,I been having very low temperatues and a very foul smelling pee. The area near my kidneys hurt a lot and I cant seem to hold my pee. I often get these uncontrollable urges
757,urinary tract infection,"I have to go the bathroom all the time, but the urine output is very low often just a few drops. My stomach hurts a lot and and cant seem to be able to control my urges to pee"
758,urinary tract infection,My is pee is dark and often bloody and often has a very unfathomable smell. I have been having temperature fluctuations pretty frequently and often am not able to sleep at night because of this
759,urinary tract infection,I have been having pain in my bladder and have been getting 
760,urinary tract infection,I have been urinating with blood in it. I occasionally feel queasy when urinating. I frequently almost have a fever at the same time.
761,urinary tract infection,"My pee has a strong, unpleasant scent and a hazy appearance. Since these symptoms started appearing, I regularly feel the desire to urinate at night and have been experiencing high temperatures"
762,urinary tract infection,"My stomach hurts, and I frequently acquire a temperature. I experience sudden, intense cravings to urinate. The discomfort is virtually always there and frequently gets worse at night. My pee nearly always smells bad."
763,urinary tract infection,"I've been experiencing frequent, intense, abrupt cravings to urinate. Sometimes I get blood in my pee, and it smells awful. What should I do if I believe I have an infection?"
764,urinary tract infection,I occasionally urinate with blood in it and occasionally feel queasy while doing so. Help! I also occasionally get high temps at night and have a terrible odour coming from my pee.
765,urinary tract infection,"I have lower abdominal ache and a bursting sensation when I urinate. Since I began to experience these additional symptoms, I have also been experiencing low body temperatures. I've been weak as a result of this."
766,urinary tract infection,"I have a mild temperature and blood in my pee. My head hurts almost constantly, and I frequently experience severe, involuntary desires to urinate. Additionally, I've been experiencing lower back ache"
767,urinary tract infection,"Since a few days ago, I've been experiencing low temperatures and bloody urination. My head is in excruciating pain, and my urine smells awful. I can hardly control when I urinate, and the impulses come on suddenly."
768,urinary tract infection,"I frequently vomit and get discomfort at my pelvic area. My urine occasionally smells almost unbearably bad, and there is occasionally blood in it. Because of my headaches at times, I have problems falling asleep."
769,urinary tract infection,"I have to use the restroom frequently to relieve myself, but I can't seem to get my bladder empty. I occasionally get severe, uncontrolled desires to urinate, as well as black or crimson urine."
770,urinary tract infection,"I've been experiencing really low moods and very bad urine odour. I can't seem to keep my urine back, and the area near my kidneys hurts a lot. I frequently experience these irrational cravings."
771,urinary tract infection,"I have to use the restroom frequently, yet only a few drops of pee are usually produced. My stomach aches a lot, and I can't seem to control the desire to urinate."
772,urinary tract infection,"My urine is frequently black, red, and has a really strange odour. I have been experiencing temperature changes very regularly, which usually prevents me from sleeping at night."
773,urinary tract infection,Blood has been found in my urination. I sometimes have nausea when urinating. I regularly feel like I'm almost feverish.
774,urinary tract infection,My pee smells strongly and is cloudy in appearance. I've had high temperatures and a regular urge to urinate at night since these symptoms first materialised.
775,urinary tract infection,"I've been having frequent, strong, sudden urges to urinate. I occasionally urinate with blood in it, and the stench is horrible. What ought I to do if I think I'm infected?"
776,urinary tract infection,"On rare occasions, I pee with blood in it and have mild nausea. Help! I also occasionally experience high nighttime temperatures and a dreadful urine odour."
777,urinary tract infection,"My lower abdomen hurts, and when I urinate, it feels like it's exploding. I've been having low body temps ever since I started having these new symptoms. Because of this, I've been weak."
778,urinary tract infection,"Blood is in my pee, and I have a low body temperature. I have practically continual headaches and often strong, uncontrollable need to urinate. In addition, I've started having lower back pain."
779,urinary tract infection,"I've had low temps and bloody urine for the past four days. My pee smells terrible, and my head hurts like hell. I scarcely have any control over when I urinate, and the urges strike without warning."
780,urinary tract infection,"I regularly vomit and get pelvic pain. There is occasionally blood in my pee, and it occasionally has an absolutely intolerable odour. I occasionally have trouble falling asleep because of my migraines."
781,urinary tract infection,"I need to relieve myself regularly, but I can't seem to get my bladder to empty. On sometimes, I get intense, uncontrollable urges to urinate, along with dark or red urine."
782,urinary tract infection,"My spirits have been incredibly low, and my pee smells awful. My kidney region hurts a lot, and I can't seem to hold my urine in. I get these unreasonable urges all the time."
783,urinary tract infection,"I have to go to the bathroom a lot, but generally only a few drops of urine come out. I have severe stomach pains and an overwhelming want to urinate."
784,urinary tract infection,"My urine often has a weird odour, is crimson or black in colour, and both. My body's temperature has been fluctuating often, which typically keeps me up at night."
785,allergy,"I have a runny nose and I am sneezing all the time. My eyes are itchy and often watery, and I am coughing all the time. My head hurts and all the time"
786,allergy,I have sore throat and I am sneezing all the time. Sometimes I have swelling on my face like my lips and near my eyes. I just cant stop sneezing once I start sneezing
787,allergy,I hace difficulty in breething and shortness of breath. I cough uncontrollably and get itchy eyes and swelling on my face and other body parts
788,allergy,I have a nasal congestion and blocked nose. Sometimes at night I have chest pain and tightness. I have also lost my sense of smell and taste
789,allergy,I have asthma like symptoms like wheezing and difficulty breathing. I often get fever and have headaches. I feel tired all the time
790,allergy,"I feel tired all the time, I have lost my taste and have a really sore throat. I also get feverish and often have muscle aches. Sometimes my whole body just cramps up"
791,allergy,I have been experiencing a loss of appetite and have difficulty swallowing food. I have been suffering from sore throat and runnny nose also.
792,allergy,"I feel fatigued all the time, and have a tingling sensation in my throat. I have also developed flaky skin. Sometimes I get puffy eyes and sometimes puffs up too."
793,allergy,"I have stomach cramps, nausea and diarrhea. My throat is swollen, and I have difficulty breathing. Sometimes at night night I get chest pain and nauseous."
794,allergy,I have itchy and red skin. Sometimes these result in flaking. My face and lips puff up and causes a lot of inconvinience. I get watery eyes sometimes and headches when the puffing gets severe
795,allergy,"I often sneeze and have a runny nose. My eyes are scratchy and frequently runny, and I frequently cough. My head hurts constantly."
796,allergy,"I often sneeze and have a sore throat. My lips and the area around my eyes occasionally swell. Once I start sneezing, I just can't stop."
797,allergy,"I have trouble breathing and get short of breath. I have a dry, hacking cough, itchy eyes, and swelling all over my face and body."
798,allergy,I have a plugged nose and nasal congestion. I occasionally have stiffness and chest discomfort at night. I've also lost my ability to taste and smell.
